{
  "schema_version": 1,
  "generated_utc": "2026-08-20T13:05:00Z",
  "stamp": "20260820T130500Z",
  "scope": ["PRE", "SSP"],
  "fx": 5.2,
  "min_margin_pct": 30.0,
  "notorious_only": false,
  "deal_count": 3,
  "sources": [
    {"source": "MYP", "status": "ok", "detail": "", "deals_raw": 412, "deals_kept": 1, "duration_s": 4211.0, "output_path": "results/myp_exemplo.xlsx"},
    {"source": "CardTrader", "status": "ok", "detail": "", "deals_raw": 188, "deals_kept": 1, "duration_s": 1877.5, "output_path": "outputs/ct_exemplo.xlsx"},
    {"source": "COMC", "status": "indisponível", "detail": "sem output do scan (nem CSV nem sidecar) — NAO confundir com 'ok (0 deals)'", "deals_raw": 0, "deals_kept": 0, "duration_s": null, "output_path": ""},
    {"source": "Liga", "status": "ok", "detail": "CSV de ofertas com 6h", "deals_raw": 57, "deals_kept": 1, "duration_s": 402.0, "output_path": "reports/report_exemplo.json"}
  ],
  "deals": [
    {
      "fonte": "MYP",
      "carta": "Exemplo Fictício ex",
      "set_name": "Exemplo Evolutions",
      "numero": "161/131",
      "raridade": "Comum",
      "chase_tier": "",
      "notorio": "⭐ Exemplo",
      "compra_brl": 100.0,
      "compra_usd": 19.23,
      "fx": 5.2,
      "ref_brl": 208.0,
      "ref_usd": 40.0,
      "margem_pct": 108.0,
      "lucro_brl": 108.0,
      "qtd": null,
      "valorizacao": null,
      "notas": ["raridade do MYP pouco confiável (pode ser SIR listada como Comum) — validar manualmente", "preço TCG real (tcgcsv)"],
      "link_oferta": "https://www.exemplo-marketplace.invalid/produto/0001",
      "link_tcg": "https://www.tcgplayer.com/product/000000"
    },
    {
      "fonte": "CardTrader",
      "carta": "Outro Exemplo V",
      "set_name": "Exemplo Sparks",
      "numero": "013/191",
      "raridade": "Ultra Rare",
      "chase_tier": "B",
      "notorio": "",
      "compra_brl": 63.6,
      "compra_usd": 12.0,
      "fx": 5.3,
      "ref_brl": 106.0,
      "ref_usd": 20.0,
      "margem_pct": 66.7,
      "lucro_brl": 42.4,
      "qtd": 3,
      "valorizacao": null,
      "notas": ["margem recalculada na base COMPRA (o CardTrader reporta na base revenda)"],
      "link_oferta": "https://www.cardtrader.com/cards/000000",
      "link_tcg": "https://www.tcgplayer.com/product/000001"
    },
    {
      "fonte": "Liga",
      "carta": "Terceiro Exemplo VMAX",
      "set_name": "Exemplo Evolutions",
      "numero": "",
      "raridade": "",
      "chase_tier": "",
      "notorio": "",
      "compra_brl": 250.0,
      "compra_usd": 48.08,
      "fx": 5.2,
      "ref_brl": 364.0,
      "ref_usd": 70.0,
      "margem_pct": 45.6,
      "lucro_brl": 114.0,
      "qtd": null,
      "valorizacao": null,
      "notas": ["match fuzzy (score 0.86) — validar manualmente", "a Liga não expõe número de coleção nem estoque por oferta"],
      "link_oferta": "https://www.exemplo-liga.invalid/card/0003",
      "link_tcg": "https://www.tcgplayer.com/product/000002"
    }
  ]
}
